nct_id,brief_title,why_stopped,termination_category,brief_summary,detailed_description,phase,medical_field,medical_subfield,field_source
NCT00005608,Fluorouracil-Uracil and Leucovorin in Treating Women With Metastatic Breast Cancer,Drug was pulled from the market.,Other/Unclear,RATIONALE: Drugs used in chemotherapy use different ways to stop tumor cells from dividing so they stop growing or die. Combining more than one drug may kill more tumor cells.~PURPOSE: Phase II trial to study the effectiveness of fluorouracil-uracil and leucovorin in treating women who have metastatic breast cancer.,OBJECTIVES: I. Determine the objective response rate in women with metastatic breast cancer treated with fluorouracil-uracil and leucovorin calcium as first line therapy. II. Determine time to disease progression in this patient population treated with this regimen. III. Evaluate the toxicity profile of this regimen in these patients.~OUTLINE: Patients receive oral fluorouracil-uracil and oral leucovorin calcium twice daily for 28 days followed by 1 week of rest. Treatment continues for a minimum of 2 courses in the absence of unacceptable toxicity or disease progression. Patients with responding disease receive a minimum of 6 courses of treatment. Patients are followed for survival.~PROJECTED ACCRUAL: A total of 22-33 patients will be accrued for this study within 13-14 months.,PHASE2,Oncology,breast cancer,MeSH
NCT04212221,MGD013 Monotherapy and Combination With Brivanib Dose Escalation and Expansion Study in Advanced Liver Cancer Patients,Due to the rapid shifting of liver cancer disease landscape and the company's adjustment of development strategy.,Other/Unclear,"This study consists of two parts: Phase I is a dose escalation study to determine the Recommended Phase II Dose (RP2D) of MGD013 monotherapy and that of MGD013 when in combination with Brivanib Alaninate (ZL-2301) in subjects with advanced liver cancer (including hepatocellular carcinoma and intrahepatic cholangiocarcinoma). Phase II is a dose expansion study and consists of two parts: Part 1 is to assess the safety and efficacy of MGD013 monotherapy and MGD013 in combination with ZL-2301 in subjects with advanced hepatocellular carcinoma (HCC); in Part 2, a therapeutic method (MGD013 monotherapy or MGD013 in combination with ZL-2301, determined by the sponsor according to the obtained data) will be selected for dose expansion study in HCC subjects who have previously failed immune checkpoint inhibitor treatment, to further evaluate the safety and efficacy of the study treatments in the specific group of subjects.",,PHASE1/PHASE2,Oncology,Other cancer,Condition
NCT04939701,Study of ASP0739 Alone and With Pembrolizumab in Advanced Solid Tumors With NY-ESO-1 Expression Participants,"The comprehensive assessment of other studies indicated the lack of significant monotherapy activity, therefore, team decided to terminate the study.",Other/Unclear,"The purpose of this study was to evaluate the safety, and tolerability of ASP0739, when administered as a single agent and in combination with pembrolizumab.~This study also evaluated the clinical response and other measures of anticancer activity of ASP0739 when administered as a single agent and in combination with pembrolizumab based on central and local assessment.","The study comprised of 2 phases. Phase 1 (dose escalation) included participants with solid tumors known to express New York esophageal squamous cell carcinoma 1 (NY-ESO-1). Phase 2 (ASP0739 as single agent and in combination with pembrolizumab) included participants with relapsed/refractory Synovial Sarcoma (SS), myxoid/round cell liposarcoma (MRCL), and ovarian cancer who had not responded to Standard of Care (SOC) or were ineligible for standard therapy. Phase 2 single agent also included a cohort of participants with select solid tumors known to express NY-ESO-1 (melanoma, Non Small Cell Lung Cancer-adenocarcinoma \[NSCLC\], squamous cell and esophageal squamous cell carcinoma \[ESCC\]). Japanese participants were only enrolled into the monotherapy arm of the dose expansion cohort.",PHASE1/PHASE2,Oncology,Other cancer,MeSH
NCT00909363,Thrombocytopenia and Bleeding in Wiskott-Aldrich Syndrome (WAS) Patients,retirement of PI,Other/Unclear,The purpose of this project is to describe the pathophysiology of thrombocytopenia and bleeding in patients with Wiskott-Aldrich Syndrome (WAS) and determine the response to thrombopoietic agents in vitro and in vivo.,"Wiskott Aldrich Syndrome is an X-linked disease characterized by immunodeficiency, eczema and thrombocytopenia; a milder form of the disease known as X-Linked thrombocytopenia also exists. The thrombocytopenia in both WAS and XLT is characterized by: severe thrombocytopenia with platelet counts frequently less than 10-30,000/ul; small platelets which may be dysfunctional; and, as a result, a high rate of serious bleeding including intracranial hemorrhage.~Because eltrombopag has been shown to be remarkably efficacious in substantially increasing platelet counts in a high percentage of ITP patients, this study seeks to effectively treat patients who exhibit similar pathologies, as well as evaluate the state of platelets in patients with WAS and relate it to clinical bleeding. It also aims to demonstrate whether eltrombopag administered daily will enhance stem cell function, increase platelet production and platelet count, and reduce bleeding in patients with WAS.",PHASE2,Hematology,Hematology disorder,MeSH
NCT00519831,Ph II of Vinflunine and Cetuximab in Second Line Treatment of NSCLC,Drug unavailable,Other/Unclear,"RATIONALE: Drugs used in chemotherapy, such as vinflunine, work in different ways to stop the growth of tumor cells, either by killing the cells or by stopping them from dividing. Monoclonal antibodies, such as cetuximab, can block tumor growth in different ways. Some find tumor cells and help kill them or carry tumor-killing substances to them. Others interfere with the ability of tumor cells to grow and spread. Giving vinflunine together with cetuximab may kill more tumor cells.~PURPOSE: This phase II trial is studying how well giving vinflunine together with cetuximab works as second-line therapy in treating patients with stage IIIB or stage IV non-small cell lung cancer.","OBJECTIVES:~Primary~* Estimate the objective response rate in patients receiving vinflunine and cetuximab as second-line therapy for stage IIIB or IV non-small cell lung cancer.~Secondary~* Determine the progression-free survival of patients treated with this regimen.~* Determine the safety of this regimen in these patients.~* Determine the overall survival of patients treated with this regimen.~* Determine the duration of overall response in these patients.~OUTLINE: This is a multicenter study.~Patients receive vinflunine IV over 15-20 minutes on day 1 and cetuximab IV over 60-120 minutes on days 1, 8, and 15. Treatment repeats every 21 days for 4 courses in the absence of disease progression or unacceptable toxicity. Patients with responding disease may receive additional courses beyond 4 courses at the discretion of the principal investigator.~After completion of study therapy, patients are followed periodically for 6 months.",PHASE2,Pulmonology,Pulmonology disorder,MeSH
NCT00204152,Treatment for Chronic Depression,PI left U of C,Other/Unclear,"The purpose of this study is to test the clinical efficacy of two psychotherapies for early onset chronic major depression, including Behavioral Activation (Jacobson et al., 2001), and an integrated version of Behavioral Activation and Stress Innoculation Coping (BASIC) for short-term (16 weeks) of individual psychotherapy for adults with chronic major depression. The control condition is an individual workbook condition of Behavioral Activation. These psychotherapies focus on behavior activation, stress reduction and coping strategies to counter depressive symptoms.","Early-onset unipolar major depression is linked with considerable morbidity and mortality (Birmaher et al., 1996). The goal of this project is to test the efficacy of Behavioral Activation (BA; Jacobson et al., 2001) and an integrated version of Behavioral Activation (BA + Stress Inoculation Coping; BASIC) for the short-term psychotherapy of adults with chronic major depression (onset before age 18) and a history of early life stress before age 18. Exposure to stress during the developmental years has been linked with early-onset depression (Rao et al., 1996), a propensity to generate stress during the life span (Hammen et al., 1998), and a greater psychological sensitivity to stress as an adult (Post et al., 1992). And while incidence of early life stress is high among depressed adults, there are no behavioral treatments designed to address the unique needs of these individuals. We aim to develop a new treatment for a specific group of depressed patients, namely individuals who report early onset of depression and early life stress. We include the critical elements of behavioral activation and stress reduction strategies to address the avoidance, stress sensitivities, and coping deficits often observed in this population.~The specific aims are: 1) to determine if the addition of stress reduction strategies (packaged in BASIC) enhance the effects of BA, as indexed by the rate early remission; 2) to investigate if exposure to BA and BASIC reduce risk of relapse within three months of treatment termination, as indexed by reduced rates of relapse by the 3-month follow-up; and, 3) to learn if effects of BA are mediated by changes in activity behaviors or the acquisition of compensatory behavioral skills, and likewise whether enduring effects of BASIC are mediated by changes in stress regulation or the acquisition of stress regulation skills. Our approach is to compare BA and BASIC to a self-guided bibliotherapy of BA (control condition) using a randomized clinical trial design to distinguish between conditions. We anticipate that this study will promote our understanding about the efficacy of BA and the discovery of mechanisms of treatment response. We expect this project to facilitate our understanding of the mechanisms that promote treatment gains and contribute to depressive relapse.",PHASE3,Psychiatry,Psychiatry disorder,MeSH
NCT03628079,A Clinical Safety and Efficacy Study of Mebendazole on GI Cancer or Cancer of Unknown Origin.,Lack of effect,Other/Unclear,"This study will evaluate the safety and efficacy of mebendazole (ReposMBZ) in patient with advanced gastrointestinal cancer or cancer of unknown origin. All patients will be given ReposMBZ for 16 weeks continuous treatment, individually dosed based on the serum concentration of mebendazole.",Mebendazole has been used extensively during long time for local gut helminthic infections at low dose but also at considerably higher doses during months to years against invasive echinococcus infections. Recent research has now clearly indicated that mebendazole has anticancer effect. Given these observations and the experience of excellent tolerance to mebendazole the current clinical trial protocol is based on the repositioning strategy to more extensively investigate whether mebendazole could be developed into a useful anticancer drug.,PHASE1/PHASE2,Gastroenterology,Gastroenterology disorder,MeSH
NCT02525302,HT-100 Long-term Study in DMD Patients Who Completed HALO-DMD-02,Dosing stopped,Other/Unclear,"This study, HALO-DMD-03, is a follow-on study to HALO-DMD-01 and HALO-DMD-02, and allows continued open-label access to HT-100 for subjects who have completed these studies. HALO-DMD-03 will provide safety and strength and function data on continuous long-term dosing. Data from this study will be used to inform the safety, tolerability, and dose selection for a future trial of HT-100 in boys with Duchenne Muscular Dystrophy (DMD).","As a follow-on study to the initial clinical studies of HT-100 in DMD (Protocols HALO-DMD-01 and HALO-DMD-02), this open-label study is designed to provide data on continuous long-term dosing. Subjects will be entered into the study without cessation of dosing, in a staggered fashion, into the same cohort assignment they had in the predecessor studies. Up to 30 subjects who have completed dosing in HALO-DMD-02 will be offered the opportunity to continue on the same dose regimen until market approval of HT-100 or termination of the study by the Sponsor. Reasons for termination could include, among others, safety concerns or lack of efficacy, based on analysis of combined data from all HT-100 studies. Safety data from subjects approaching the end the HALO-DMD-02 participation will be individually reviewed by the Medical Monitor and the subject's physician (Principal Investigator \[PI\]). If the Medical Monitor and the PI agree there are no clinically significant safety signals (absence of clinically significant laboratory or clinical abnormalities to date), the subject will be considered eligible and offered continuation of dosing. To avoid an interruption in dosing, subjects will immediately be screened for participation and enrolled upon completing the predecessor trial, HALO-DMD-02. Participation is in this study HALO-DMD-03 is optional. Safety and pharmacodynamics (PD) monitoring will continue throughout the subject's study participation. Dose reduction/modification might occur or individual subjects' participation in the trial may be discontinued if any Adverse Events (AEs) suggest that HT-100 is not sufficiently well tolerated.",PHASE2,Orthopedics,Orthopedics disorder,MeSH
NCT01566630,Safety and Efficacy of RLX030 in Pregnant Women With Pre- Eclampsia,"Novartis terminated this study due to internal, strategic decisions.",Other/Unclear,This study is designed in two parts. Part 1 will assess the safety and tolerability of different doses of RLX030 when given to pregnant women with pre- eclampsia (elevated blood pressure with protein in urine). Part 2 will assess whether an optimal dose of RLX030 can prolong pregnancy in women with pre-eclampsia.,,PHASE2,Cardiology,Hypertension,MeSH
NCT00346151,Belatacept to Prevent Organ Rejection in Kidney Transplant Patients,Stopping rule-acute rejection threshold-was met based on local biopsy results,Other/Unclear,"Belatacept is an experimental medication shown in clinical trials to have immune system suppression properties in people who have had renal (e.g., kidney) transplants. This study will determine whether a combination of anti-rejection drugs, including belatacept, can prevent the rejection of a first-time, non-human leukocyte antigen (HLA) identical renal transplant and allow patients to be safely withdrawn from anti-rejection therapy one year post-transplant.","Drugs that suppress the immune system have contributed to increased success of transplantation; however, to prevent organ rejection, transplant recipients need to take immunosuppressive drugs for the rest of their lives. These drugs make patients more susceptible to infection and certain kinds of cancer. Belatacept is an experimental medication that specifically targets immune reactions against transplanted organs and has been shown to be effective in preventing kidney transplant rejection in previous clinical trials. Both thymoglobulin, an antibody, and sirolimus, an anti-rejection drug, prevent rejection by lowering the response of the immune system to the transplanted organ. This study will evaluate whether belatacept, along with thymoglobulin and sirolimus, is safe in kidney transplant patients. The study will also evaluate this regimen's potential to allow tapering and eventual discontinuation of all immunosuppressive drugs.~This study will last up to 4 years. At the time of transplant, participants will begin an immunosuppressive treatment regimen consisting of thymoglobulin, sirolimus, and belatacept. Participants will receive infusions of thymoglobulin on days 1 through 4, and a combination of oral sirolimus (daily) and belatacept infusions at day 5, then weeks 2, 4, 8, and monthly for at least 2 years. Dose reduction of belatacept will occur at 12 weeks post-transplant. At Year 2, eligible participants may choose to begin drug withdrawal or continue study therapy through the end of the study. Study visits will occur weekly for the first two months, then monthly. These visits will include belatacept treatment, general medical assessments, blood and urine collection, and other assessments to determine overall health of the recipient's immune system and kidney transplant and to better understand the way the immune system works in the acceptance or rejection of organ transplants.~\*\*\* IMPORTANT NOTICE: \*\*\* The National Institute of Allergy and Infectious Diseases and the Immune Tolerance Network do not recommend the discontinuation of immunosuppressive therapy for recipients of cell, organ, or tissue transplants outside of physician-directed, controlled clinical studies. Discontinuation of prescribed immunosuppressive therapy can result in serious health consequences and should only be performed in certain rare circumstances, upon the recommendation and with the guidance of your health care provider.",PHASE2,Nephrology,Nephrology disorder,Condition
