nct_id,brief_title,why_stopped,termination_category,brief_summary,detailed_description,phase,medical_field,medical_subfield,field_source
NCT00642135,CLAIR -FO: Clinical Trial of Ophthalmic Insert Mydriasert® Versus Reference Treatment,The total number of patients has been reached.,Other/Unclear,"Pupillary dilation to perform a fundus in premature newborns and neonates is often difficult to obtain, because of the non mature iris sphincter. The fundus is essential to detect retinal anomalies (as retinopathy of prematurity or chorioretinal or disk anomalies). The aim of the study is to obtain a satisfactory degree of mydriasis with a minimal dose of two mydriatic treatments, with an optimal duration and a good tolerance of the drugs. The study will evaluate the mydriasis in premature newborns, neonates and infants justifying a mydriasis for a bilateral diagnosis fundus, using ophthalmic insert Mydriasert® versus reference treatment (association of phenylephrine and tropicamide eyedrops). Ophthalmic insert Mydriasert® can control drug dispensation and decrease the number of nurse interventions to obtain mydriasis in patients.","The aim of the study is to obtain a satisfactory degree of mydriasis with a minimal dose of two mydriatic treatments, with an optimal duration and a good tolerance of the drugs. The study will evaluate the mydriasis in premature newborns, neonates and infants justifying a mydriasis for a bilateral diagnosis fundus, using ophthalmic insert Mydriasert® versus reference treatment (association of phenylephrine and tropicamide eyedrops). Ophthalmic insert Mydriasert® can control drug dispensation and decrease the number of nurse interventions to obtain mydriasis in patients.",PHASE3,Ophthalmology,Ophthalmology disorder,MeSH
NCT00800007,Study of Safety and Tolerability of Multiple Intravenous Doses of ANZ-521 in Adults With Chronic Hepatitis C Virus,,Unknown,"The purpose of this study is to evaluate the safety, immunogenicity, and antiviral effects of multiple intravenous doses of ANZ-521 in patients with chronic Hepatitis C virus.","This Phase 1/2 Randomized, Placebo Controlled, Double-Blind clinical trial will evaluate the safety, tolerability, and pharmacodynamics of ANZ-521, an investigational product that is a weakened form (attenuated) of Listeria monocytogenes, a type of bacteria that is commonly found in the environment. ANZ-521 has been altered in the lab to reduce its ability to cause disease, while maintaining stimulation of the immune system. ANZ-521 has also been genetically modified with recombinant DNA to encode consensus sequence antigens called NS5B polymerase and NS3 proteinase that correspond to viral proteins found on the virus causing Hepatitis C. It is hoped that ANZ-521 will stimulate an immune response to the Hepatitis C virus (HCV) in the liver, thereby demonstrating an effective therapy for individuals with chronic HCV infection.~The purpose of this first clinical trial with ANZ-521 is to identify an appropriate dose of the investigational agent for later clinical studies and to explore safety when given to consenting adults with HCV. Immunological response to ANZ-521 in study participants will also be measured. Patients who choose to enter the study must meet all study entry criteria. The first part of the study (Part A) will enroll subjects who have received prior treatment with standard of care therapy for HCV. The second part of the study (Part B) will enroll subjects who have not previously received standard of care therapy for HCV or were intolerant to standard of care. Qualifying study patients will be assigned to receive one of at least 2 dose levels of ANZ-521 or placebo. Each patient may receive up to 3 intravenous administrations (28 days apart) of ANZ-521 or placebo at their assigned dose level.",PHASE1/PHASE2,Infectious Diseases,Infectious Diseases disorder,MeSH
NCT00217074,Acupuncture and Hot Flashes,,Unknown,"Methods: 103 participants, after being randomized to medical versus sham acupuncture received bi-weekly treatments for 5 weeks, after a baseline assessment week. They were then followed for an additional 7 weeks. Participants completed daily hot flash questionnaires, which formed the basis for analysis.",,PHASE3,Unknown,,Unable to classify
NCT03368859,"A Study of ABT-165 Plus FOLFIRI vs Bevacizumab Plus FOLFIRI in Subjects With Metastatic Colorectal Cancer Previously Treated With Fluoropyrimidine, Oxaliplatin and Bevacizumab",Study may continue,Other/Unclear,A study to evaluate the efficacy and tolerability of ABT-165 plus FOLFIRI compared to bevacizumab plus FOLFIRI in participants with previously treated metastatic adenocarcinoma of the colon or rectum.,,PHASE2,Gastroenterology,Gastroenterology disorder,MeSH
NCT00067041,Effects of Remodulin in Patients With Critical Limb Ischemia Following a Vein Bypass Graft,,Unknown,Approximately 30 patients will be enrolled in this 12-week study designed to assess the effect of continuous subcutaneous Remodulin therapy on the outcome of infrainguinal bypass grafts in patients with critical limb ischemia (CLI). Portions of the study will be conducted in the hospital and on an out-patient basis. The study will be conducted at multiple centers.,,PHASE2/PHASE3,Cardiology,Cardiac disorder,MeSH
NCT02661022,SL-401 in Combination With Pomalidomide and Dexamethasone in Relapsed or Relapsed and Refractory Multiple Myeloma,,Unknown,"A Phase 1/2, Open Label Study of SL-401 in Combination with Pomalidomide and Dexamethasone In Relapsed and Refractory Multiple Myeloma","This study is a phase 1/2 multicenter, open-label study of SL-401 (tagraxofusp-erzs) in combination with standard doses of pomalidomide and dexamethasone in patients with relapsed and refractory multiple myeloma (MM). The study will be conducted in 2 phases: Phase 1 is the dose-escalation phase to determine the maximum tested dose (MTD) of SL-401 in combination with standard doses of pomalidomide and dexamethasone. In Phase 1, each evaluated SL-401 dose level will incorporate an initial Run-in Cycle (i.e. cycle 1) of single agent SL-401 in at least 3 patients; following the Run-in Cycle, patients who have not experienced a dose-limiting toxicity (DLT) will receive combination SL-401/pomalidomide and dexamethasone in cycles 2 and beyond. All patients in Phase 2 will receive 1 cycle of SL-401 monotherapy in cycle 1, followed by combination of SL-401/pomalidomide/dexamethasone in cycle 2 and beyond. The dose of SL-401 will be the MTD of SL-401 or MTD given in combination with pomalidomide/dexamethasone determined during Phase 1.",PHASE1/PHASE2,Oncology,Other cancer,MeSH
NCT00493857,Study of Nimotuzumab and Irinotecan in Metastatic Colorectal Cancer,Cohort 2 not going forward. Manadate changes in Company,Other/Unclear,"This study will determine if nimotuzumab provides a benefit in this type of cancer when given in combination with irinotecan.~The study will test:~* How long any good effects last.~* How bad any side effects are.~Objectives:~Primary:~The primary goal is to assess the Objective Response Rate (ORR) that the combination of irinotecan and nimotuzumab will produce in patients with irinotecan-refractory metastatic colorectal cancer~Secondary:~* To assess the incidence of Grade 2 or greater acneiform rash or infusion reaction, allergic reaction or anaphylactoid reaction AEs in patients with irinotecan-refractory metastatic colorectal cancer following weekly or 2-weekly nimotuzumab schedules;~* To assess Progression-Free Survival (PFS), defined as time from date of randomization until date of disease progression (clinical or radiological) or death due to any cause, for the two nimotuzumab schedules;~* To assess the rates and durations of Stable Disease (SD) following weekly or 2-weekly nimotuzumab schedules;~* To assess the Time to Disease Progression (TTP) following weekly or 2-weekly nimotuzumab schedules;~* To evaluate ORR in patients who are identified as having primary irinotecan resistance following weekly or 2-weekly nimotuzumab schedules;~* To evaluate Overall Survival (OS) following weekly or 2-weekly nimotuzumab schedules;~* To compare the two dosing schedules of nimotuzumab with respect to objective response rates and safety;~* To evaluate the overall safety and toxicity profiles of these two dose regimens of nimotuzumab;~* To evaluate trough levels and accumulation of nimotuzumab in serum of patients receiving the drug on weekly or 2-weekly regimens.","The patient will receive nimotuzumab every 2 weeks plus irinotecan. Nimotuzumab will be given at a dose of 400 mg once every 2 weeks for 12 weeks. Irinotecan will be given at the same dose and schedule as the last dose and schedule given during the most recent pre-study irinotecan containing therapy. If the tumour does not show signs of further growth after 12 weeks of treatment, the patient will continue receiving nimotuzumab 400 mg every 2 weeks for up to 18 months or as long as they are getting a benefit from the drug.",PHASE2,Gastroenterology,Gastroenterology disorder,MeSH
NCT01313663,A Study to Evaluate Pazopanib in Comparison to Pemetrexed in Maintenance Setting in Non-progressing Subjects With Metastatic Stage IVA and IVB Non-squamous Non-small Cell Lung Cancer (NSCLC) Population,,Unknown,"This is a Phase II, randomized, open-label, multi-center study in advanced (Stage IVA and IVB subjects per the International Association for the Study of Lung Cancer (IASLC) 2009 Lung cancer staging schema) non-squamous NSCLC subjects comparing pazopanib relative to pemetrexed in the maintenance setting. Subjects should have completed 4-6 cycles of induction therapy with carboplatin + pemetrexed or cisplatin + pemetrexed and have had Stable Disease (SD), Partial Response (PR) or Complete Response (CR) as the best response to be enrolled into the study. The primary objective is to estimate the hazard ratio of progression free survival (PFS) in advanced NSCLC subjects given maintenance therapy of pazopanib (Arm A) relative to pemetrexed (Arm B). The secondary objectives are: overall survival, response rates, safety and tolerability. A total of approximately 200 subjects will be enrolled and randomized in a 1:1 ratio. Safety and efficacy assessments will be regularly performed on all subjects.",,PHASE2,Pulmonology,Pulmonology disorder,MeSH
NCT03904108,Platinum-Based Chemotherapy Plus Ramucirumab in Patients With Advanced NSCLC Who Have Progressed on First Line Anti-PD-1 Immunotherapy,insufficient patient population to complete trial as planned,Other/Unclear,"This is a non-randomized, phase-II study of platinum doublet chemotherapy plus ramucirumab in patients with advanced NSCLC who have progressed on first line anti-PD-1 Immunotherapy. Up to 25 evaluable participants will be enrolled over a period of 2 years. Seven patients will be recruited at the first stage .Eligible patients would include those treated with a PD-1 inhibitor as primary therapy and exhibit evidence of disease progression, but maintain a good performance status.~The investigators hypothesize that immune therapy acts as chemo-sensitizer and patients treated with standard platinum-based combination chemotherapy with the addition of the anti-angiogenic agent Ramucirumab, after immunotherapy will have higher response rates","OBJECTIVES:~Primary Objective~1. To assess the objective response rate to a three-drug regimen (a platinum doublet plus an anti-angiogenic agent) in patients with non-small cell lung cancer who fail to respond, or progress after an initial response, to primary therapy with an immune checkpoint inhibitor.~2. To assess the toxicity profile of the three-drug regimen in this population compared to historical treatment-naïve population (as published in literature)~Exploratory Objective~1. To investigate the role of peripheral blood CD 8+ T cells, absolute eosinophil count (AEC) and circulating tumor cells (CTC) as biomarkers of response to salvage chemotherapy after primary immunotherapy~2. To investigate the role of plasma carbonic anhydrase IX level as predictive biomarker of response to ramucirumab.",PHASE2,Pulmonology,Pulmonology disorder,MeSH
NCT00144105,A Randomised Trial to Evaluate the Antiviral Efficacy and Safety of Treatment With 500 mg Tipranavir (TPV) Plus 100 mg or 200 mg Ritonavir (RTV) p.o. BID in Comparison to 400 mg Lopinavir (LPV) Plus 100 mg RTV p.o. BID in Combination With Standard Background Regimen in ARV Therapy naïve Patients.,,Unknown,Evaluation of safety and efficacy of Tipranavir (TPV) boosted with Ritonavir (RTV) versus an active control arm (Lopinavir / RTV) in antiretroviral (ARV) therapy naïve HIV-1 infected patients,,PHASE2,Infectious Diseases,Infectious Diseases disorder,MeSH
NCT01189240,RO4929097and Bevacizumab in Treating Patients With Progressive or Recurrent Malignant Glioma,Company decided to stop development of drug - 7/31/12,Other/Unclear,"This phase I/II trial is studying the side effects and the best dose of RO4929097 to see how well it works when given together with bevacizumab compared to bevacizumab alone in treating patients with progressive or recurrent malignant glioma. RO4929097 may stop the growth of tumor cells by blocking some of the enzymes needed for cell growth. Monoclonal antibodies, such as bevacizumab, can block tumor growth in different ways. Some block the ability of tumor cells to grow and spread. Others find tumor cells and help kill them or carry tumor-killing substances to them. Giving RO4929097 together with bevacizumab may kill more tumor cells.","Phase I~Primary Objective:~1. To assess the safety profile of R04929097 in combination with bevacizumab and to determine a recommended Phase II dose of R04929097 in combination with bevacizumab in patients with recurrent malignant glioma~   Secondary Objectives:~2. To describe the toxicity associated with this combination regimen~3. To assess pharmacokinetics of R04929097 in combination with bevacizumab~Phase II I. Assess the safety profile and the recommended phase II dose of gamma-secretase inhibitor RO4929097 (RO4929097) in combination with bevacizumab in patients with recurrent malignant glioma.~II. Assess the progression-free survival at 6 months of patients treated with this regimen.~III. Compare the overall survival of patients with recurrent glioblastoma treated with RO4929097 and bevacizumab versus bevacizumab alone.~SECONDARY OBJECTIVES:~I. Describe the toxicity associated with this regimen in these patients. II. Assess the pharmacokinetics of this regimen in these patients. III. Estimate the proportion of patients alive and progression-free survival at 6 months in patients treated with RO4929097 and bevacizumab versus bevacizumab alone.~IV. Evaluate the safety and tolerability of these regimens in these patients. V. Explore potential prognostic biomarkers from glioma tissue at baseline and potential association with Notch pathway inhibition.~OUTLINE: This is a multicenter, phase I, dose-escalation study of gamma-secretase inhibitor RO4929097 (RO4929097) followed by a randomized phase II study.~PHASE I: Patients receive oral RO4929097 on days 1-3, 8-10, 15-17, and 22-24, and bevacizumab IV over 30-90 minutes on days 1 and 15 (days 2 or 3 and 15 of course 1 only). Courses repeat every 28 days in the absence of disease progression or unacceptable toxicity.~PHASE II: Patients are randomized\* to 1 of 2 treatment arms.~ARM I: Patients receive oral RO4929097 on days 1-3, 8-10, 15-17, and 22-24, and bevacizumab IV over 30-90 minutes on days 1 and 15.~ARM II: Patients receive bevacizumab as in arm I.~In both arms, courses repeat every 28 days in the absence of disease progression or unacceptable toxicity.~NOTE: \*If phase II single-arm study demonstrates effectiveness, it will proceed to the phase II randomized study.~Some patients undergo blood sample collection for pharmacokinetic studies. Archived tumor tissue samples are analyzed for potential biomarkers and Notch pathway inhibition.~After completion of study therapy, patients are followed up every 2 months.",PHASE1/PHASE2,Oncology,brain tumor,MeSH
NCT02829827,A Phase 2 Study of Radiprodil in Subjects With Drug-resistant Infantile Spasms (IS),"After reviewing the feasibility and projected completion date of the study, UCB has made the decision to stop the study",Other/Unclear,"The purpose of the study is to evaluate the safety and tolerability, the pharmacokinetics and the efficacy of radiprodil in abolishing clinical spasms in subjects with drug-resistant infantile spasms","The study is divided into 3 parts:~Part A - exploratory, Part B - confirmatory, Part C - open label extension",PHASE2,Neurology,Epilepsy,MeSH
NCT00944333,Second Generation Drug-Eluting Stents Implantation Followed by Six Versus Twelve-Month - Dual Antiplatelet Therapy,STOP due to recent data in literature questioning the need to continue DAP beyond six months in patients with stable coronary artery stenting with DES.,Other/Unclear,"Prospective, randomized, non-inferiority, multicenter, international study.In total 4000 patients (70 centers in Europe) with de novo lesions in native coronary arteries who meet the eligibility criteria randomized to 6 versus 12 month dual antiplatelet therapies following a second generation DES implantation.~Assuming that the true proportion of thrombotic events is equal to 2.3% for both regimens (6-month and 12-month clopidogrel) 2000 patients for each treatment group are necessary to demonstrate a non-inferiority of the 6-months regimen if the proportion of thrombotic events will be no more than 3.5% with a power of 0.80 and a significance level of 0.05 (one-tail).~If the non-inferiority hypothesis will be rejected, the superiority hypothesis (12-months regimen is superior to the 6-months-regimen) will be tested at a significance level of 0.05 (two-tails).~The maximal not clinically relevant difference for the non-inferiority hypothesis of 1.2 % more thrombotic events has to be considered together with the lower expected number of bleeding events in the 6-months regimen.~All the analysis will be done as intention-to-treat analysis.",,PHASE3,Cardiology,Cardiac disorder,MeSH
NCT04750759,Safety and Preliminary Efficacy of the Combination of Niclosamide and Camostat,sub-therapeutic plasma levels of active substance,Other/Unclear,Niclosamide (2000 mg QD) and Camostate (600 mg QID) are expected to be safe and well-tolerated as a combination therapy and to show clinically beneficial for COVID-19 patients.,"Niclosamide is an approved drug for the treatment of intestinal worm infections that can potentially induce the process of autophagy and thus significantly limit viral replication in cells.~Camostat is approved in Japan for the treatment of chronic pancreatitis and reflux esophagitis. It has been shown to effectively block viral replication in a SARS-CoV-2 animal model.~Since the mechanisms of actions are different, it was hypothesized that a combination of both substances might have an additive or even synergistic effect in the treatment of patients with COVID-19.~This study is designed to investigate the safety, tolerability and preliminary efficacy of the treatment combination niclosamide and camostat in mild and moderately affected COVID-19 patients.",PHASE2,Infectious Diseases,Infectious Diseases disorder,MeSH
NCT00215852,"A Randomized, Dose-ranging Study of Alferon LDO in Asymptomatic HIV+ Subjects",,Unknown,To conduct a randomized dose-ranging study to evaluate the safety and activity of orally administered low dose interferon alfa-n3 as an immunomodulator in subjects with asymptomatic HIV-1 infection. The primary endpoints of the study will include an increase or upregulation in genes known to be mediators of interferon response. Secondary endpoints will include the absolute CD4 count and plasma HIV RNA levels.,"This study will be an open-label, randomized outpatient study in HIV infected subjects using a range of doses of Alferon LDO. The first nine (9) patients enrolled will not be randomized. Instead, the first three (3) patients will receive 500 IU, the second three (3) patients will receive 1000 IU, and the final three (3) patients will receive 2000 IU. Once three (3) patients at a given dose level have received at least 8 doses without grade 3 toxicity, patients may be enrolled at the next higher dose level. Following enrollment of the first nine (9) patients, additional patients will be randomized to receive one of the three (3) dose levels of Alferon® LDO. The Alferon LDO (natural interferon alfa-n3) will be in a buffer solution and taken orally once each day for 10 consecutive days at doses equal to 500 IU, 1000 IU, or 2000 IU.~Pretherapy baseline evaluations will be performed within the three (3) week period prior to randomization.~Drug will be dispensed for a ten day treatment period, during which time any clinical symptoms and adverse events will be evaluated. Laboratory samples (2.5 ml blood) for microarray analysis evaluations will be made twice during baseline and 12-14 hours following doses 1, 4, and 10 on study days 2, 5, and 11, respectively.",PHASE2,Infectious Diseases,Infectious Diseases disorder,MeSH
NCT01668680,Maintenance Metronomic Chemotherapy for Metastatic Colorectal Carcinoma,No satisfactory acrual,Other/Unclear,"Colorectal cancer patients with metastases (mCRC) at response under expensive chemotherapy which may be toxic +/- exhausting are candidates for an effective and more convenient maintenance treatment.~Objectives:~1. To define the efficacy of maintenance chemotherapy by a low-dose metronomic (LDM) regimen, in metastatic CRC patients responding under FOLFIRI + bevacizumab.~2. To discover predictive factors for response to this LDM regimen.~Hypothesis:~1. The re-growth of residual metastases can be slowed by the anti-angiogenic effects of LDM chemotherapy.~2. Serial measurements of angiogenic/ inflammatory factors in the plasma and/or evaluation of certain enzymes in the tumor may discover predictive factors of response to LDM chemotherapy in metastatic CRC patients.","At entry to the research protocol the up-till then administered treatment with Intra Venous FOLFIRI+BEVACIZUMAB will be stopped.Instead, the research oral treatment will be initiated to be taken daily on an ambulatory basis and under once monthly re-evaluation. If and when disease progresses the original FOLFIRI+BEVACIZUMAB treatment will be considered for re-institution.",PHASE2,Oncology,colon cancer,Condition
