nct_id,brief_title,why_stopped,termination_category,brief_summary,detailed_description,phase,medical_field,medical_subfield,field_source
NCT00790478,Melatonin and Ulcerative Colitis: A Pilot Clinical Trial,,Unknown,"Ulcerative colitis is an inflammatory bowel disease that afflicts up to one million people in the U.S. Symptoms include rectal urgency, bloody diarrhea, moderate to severe abdominal pain, fever, and fatigue. Melatonin is a hormone that is associated with sleep and other body functions that may be related to health. Melatonin is produced in the pineal gland and, in fact, it is produced in even greater amounts in the gut. Melatonin appears to be important in gastrointestinal tract physiology and health, and data from cell and animal experiments, and some studies in humans, suggest that supplemental melatonin may help ameliorate colitis. Given that current treatments for ulcerative colitis are not always effective, and often have serious side effects, there is considerable interest in finding alternative treatments for this disease. However, experimental data on the ability of melatonin to improve ulcerative colitis in humans are lacking. To address this, we plan to conduct a pilot clinical trial (60 adult male and female participants) that will obtain preliminary data about the effectiveness of melatonin supplementation as a treatment for ulcerative colitis in adult men and women with the disease.~The Melatonin and Ulcerative Colitis study funded by a grant from the Broad Foundation's Broad Medical Research Program (http://www.broadmedical.org).","Problem of Interest:~Current treatments for ulcerative colitis are not always effective, and often have serious side effects. Therefore, there is considerable interest in finding alternative treatments for this disease. Physiologic data suggest that melatonin is important in gastrointestinal (GI) tract physiology and health, and data from in vitro studies, animal experiments, and some studies in humans suggest that supplemental melatonin may have an ameliorative effect on colitis. However, experimental data on the ability of melatonin to improve ulcerative colitis in humans are lacking. The long-term goal of this proposal is to examine whether melatonin supplementation helps alleviate mild-to-moderate colitis symptoms. To this end, we plan to conduct a pilot randomized, double-blind, placebo-controlled trial (n = 60) that will obtain preliminary data about the effectiveness of melatonin supplementation as a treatment for ulcerative colitis in adult men and women with mild to moderate flare-up of the disease. The specific aims of the trial are: (i) to estimate the effect of 12 weeks of 5 mg/day supplementation with melatonin on ulcerative colitis remission, (ii) to estimate the effects of melatonin supplementation on tissue levels of cytokines and other markers of inflammation, (iii) to determine whether melatonin's effects vary according to baseline (endogenous) melatonin levels, (iv) to determine the feasibility of recruiting and retaining a sufficient number of ulcerative colitis patients for a larger, more definitive study, and (v) to determine whether melatonin supplementation has any adverse side-effects when taken daily for 12 weeks in adults with ulcerative colitis.~How the Problem Will Be Studied:~The overall study design of this trial is that of a randomized, double-blind, placebo-controlled clinical trial. Patients will be recruited from those seeing their IBD clinicians at one of three study sites: Emory University, Atlanta Gastroenterology Associates, or the Atlanta VA Medical Center. Eligibility will be based first on the severity of disease, determined by physician exam, and through sigmoidoscopy (as part of the Mayo Scoring System). The Project Coordinator will meet with patients to further determine eligibility, as there are restrictions based on age, medical history, medications taken, pregnancy, and others. Willing patients who are otherwise eligible at that point will undergo a one-week placebo run-in to assess compliance and any reported side-effects. Eligible patients will undergo their first study sigmoidoscopy, will provide biological samples for processing (blood, urine, and rectal biopsy tissue), and will be randomized into treatment (5 mg/d at bedtime) or placebo (also at bedtime). They will be given sleep logs and symptoms logs to fill out weekly during the trial, and they will fill out a colitis-related quality of life questionnaire. They will be called once per week by the Project Coordinator to check on the study participants, to assess compliance and side-effects, and to answer any questions. There will be a clinical visit two weeks after randomization, to assess symptoms and any side effects. The next scheduled clinical visit is at the end of the trial, where another sigmoidoscopy and sample collection will take place. Any other interim clinical visit will be at the discretion of the patients and his or her study physician. Lastly, patients will complete a questionnaire about colitis-related quality of life during the trial and will be asked as to whether they suspected which treatment arm they were in. The following period will be devoted to data analysis, publication of study results, and closeout. Please see attached protocol for details.~Importance of the Knowledge to be Gained:~The proposed research will have both public health and scientific importance. Ulcerative colitis is not a rare condition, and sufferers often deal with debilitating symptoms. Thus, a greater understanding of ways of treat ulcerative colitis would be of potential relevance to a great number of people.~How the Research Will Advance Scientific Knowledge and/or Human Health~UC is a common gastrointestinal disorder in adults, one that can have debilitating symptoms and severe health consequences. Current treatments are not always effective, and often have serious side effects. Therefore, there is considerable interest in finding alternative treatments for this disease. Physiologic data suggest that melatonin is important in GI tract physiology and health, and data from in vitro studies, animal experiments, and some studies in humans, suggest that supplemental melatonin may have an ameliorative effect on colitis. Given our newly-funded pilot clinical trial was awarded the maximum funding available from the Broad Foundation, with no funds allocated to explore potentially important biological mechanisms, we feel that this is an excellent opportunity to validate potential clinical benefits of melatonin as an adjunctive therapy for UC in humans, with mechanistic insights into the various levels of the inflammatory process that may be influenced by melatonin in vivo. Thus, the proposed study is a) innovative, b) supported by experimental data, and c) may ultimately lead to improved treatment of UC based on clinical and mechanistic knowledge gained through this study conducted in human patients.~To date, there has been no formal clinical trial of melatonin therapy for UC in humans, and there have been few mechanistic investigations into the potential mode of action of this compound on the pathomechanisms identified thus far. Given the very low toxicity documented for even high levels of melatonin in animals and human subjects, this relatively inexpensive treatment may represent an attractive alternative for patient suffering from mild to mid-grade UC given the low incidence of side effects.",PHASE2,Gastroenterology,Gastroenterology disorder,MeSH
NCT00547274,Dyslipidemia in Type 2 Diabetes (0767-034),,Unknown,"The purpose of the study is to compare the lipid-altering effects of MK0767, glipizide, and pioglitazone after 12 weeks of treatment.~This is an early phase trial and some specific protocol information is in progress and not publicly available at this time. (Full information is available to trial participants).",,PHASE3,Endocrinology,Endocrinology disorder,MeSH
NCT00254891,Trial of Paclitaxel/Carboplatin + PF-3512676 vs Paclitaxel/Carboplatin Alone in Patients With Advanced Non-Small Cell Lung Cancer,See Termination Reason in Detailed Description,Other/Unclear,To assess the efficacy and safety of PF-3512676 administered in combination with paclitaxel/carboplatin chemotherapy as first-line treatment in patients with locally advanced or metastatic Non-Small-Cell Lung Cancer (NSCLC) and to compare it to the efficacy and safety of paclitaxel,"PF-3512676 dosing was stopped 20 June 2007 in response to DSMC recommendation to close the trial, citing lack of efficacy concerns as the primary reason with a safety issue (sepsis) also contributing to the decision. Subjects were allowed to complete standard of care treatment/survival follow-up. Data collection was completed on 17 July 2008.",PHASE3,Pulmonology,Pulmonology disorder,MeSH
NCT00305383,Viral Kinetic Study With Viramidine in Therapy-Naive Patients With Chronic Hepatitis C,Dose levels were determined to be subtherapeutic,Other/Unclear,The purpose of this study is to examine the rapid virologic response (RVR) at combination therapy (CT) Week 4 between groups receiving a standard combination peginterferon alfa-2b/viramidine dosing regimen versus a cohort that receives 4 weeks of viramidine monotherapy prior to the start of peginterferon alfa-2b/viramidine combination therapy.,"This Phase 2b multicenter study, which is being conducted solely in the United States, consists of a randomized, double-blind, monotherapy period, where patients will receive either viramidine or placebo for 4 weeks. After the monotherapy period, all patients will receive viramidine plus peginterferon alfa-2b combination therapy for 48 weeks in an open-label fashion and will then participate in a 24-week follow-up period after completion of combination therapy. The RVR at CT Week 4 between groups receiving a standard combination peginterferon alfa-2b/viramidine dosing regimen versus a cohort that receives 4 weeks of viramidine monotherapy prior to the start of peginterferon alfa-2b/viramidine combination therapy will be examined. The differences in virological response during treatment and end of follow-up between African-Americans and Caucasians (non-Hispanics), as well as a correlation between duration of viral negativity (DVN) and sustained virologic response (SVR) based on race and dosing regimen, will also be assessed.",PHASE2,Infectious Diseases,Infectious Diseases disorder,MeSH
NCT02664961,Study of TRC105 and Bevacizumab in Patients With Refractory Gestational Trophoblastic Neoplasia (GTN),"Rare tumor type, patients eligible via expanded access.",Other/Unclear,"The purpose of the study is to determine the overall response rate of single agent TRC105 and the combination of TRC105 and bevacizumab in patients with refractory GTN (including choriocarcinoma, placental site trophoblastic tumor (PSTT), and epithelioid trophoblastic tumor (ETT)). Up to 30 patients will be treated.","TRC105 is a monoclonal antibody that binds to endoglin, an angiogenic target highly expressed on the tumor vessels and tumor cells in gestational trophoblastic neoplasia (GTN). Bevacizumab is a monoclonal antibody to vascular endothelial growth factor (VEGF) that inhibits angiogenesis and extends survival in patients with a wide variety of solid tumor types. TRC105 has been well tolerated as a single agent and when combined with bevacizumab. These antibodies may be efficacious in refractory GTN, a tumor type that is highly vascular and has been shown to densely express endoglin.",PHASE2,Oncology,Other cancer,MeSH
NCT01222143,"Safety and Efficacy Study of Nilotinib Combined With Mitoxantrone, Etoposide, and High-dose Cytarabine Induction Chemotherapy Followed by Consolidation for Patients With C-kit Positive Acute Myeloid Leukemia",,Unknown,"This is a phase I/II open-label study that is evaluating the toxicity and efficacy of nilotinib combined with mitoxantrone, etoposide, and high-dose cytarabine (NOVE-HiDAC) chemotherapy for patients with poor-risk acute myeloid leukemia (AML). There are two parts to the study. The first part (Phase I) will determine the maximum dose of nilotinib that can safely be given when combined with NOVE-HiDAC. This dose will then be used in combination with the NOVE-HiDAC regimen in the second part of the study (Phase II), which will evaluate the antileukemic activity of the treatment. The patients who achieve complete remission from the induction therapy (1 cycle) will then receive consolidation therapy combined with nilotinib (maximum of 2 cycles).~The patient population for this study will have AML and will fall into a poor risk category. This means they have persistent leukemia after induction therapy, they relapse within two years of achieving complete remission with induction therapy, or they have certain poor risk features at diagnosis. The AML cells will also be positive for c-kit (a stem cell factor receptor), which is involved in cancer cell growth. Nilotinib is a drug that blocks the effects of c-kit. Using this drug in combination with chemotherapy may improve ability of the chemotherapy drugs to kill leukemia cells. This may then increase the chances of the leukemia going into complete remission.",,PHASE1/PHASE2,Oncology,leukemia,MeSH
NCT00562887,"Dose Ranging Study Comparing the Efficacy, Safety and Pharmacokinetics of Intravenous Infusions of ABT-874 vs Placebo in Subjects With Active Crohn's Disease",,Unknown,"To compare the efficacy, safety and pharmacokinetics of ABT-874 to placebo in subjects who have moderately to severely active Crohn's Disease.",,PHASE2,Gastroenterology,Gastroenterology disorder,MeSH
NCT00555646,Topical PH-10 Aqueous Hydrogel and Photodynamic Therapy for Psoriasis,Change of dose regimen (new protocol),Other/Unclear,"This is an open label, single center, controlled study with each subject's two treatment plaque areas assigned by the investigator 1:1 to (a) PH-10 with ambient light exposure and (b) PH-10 with 544 nm LED light illumination at 10 J/cm2. A third plaque area will receive no treatment and serve as a control.~Subjects with at least three distinct, stable study plaque areas will receive the experimental therapy to two treatment plaque areas twice a week (2-5 days apart) for the lesser of 12 weeks or until remission is observed in the treatment plaque areas. If remission is observed in a treatment plaque area then treatment of that area will be discontinued and the area assessed weekly. A third plaque area (control plaque area) will receive no drug or light treatment and serve as an internal control.~Primary efficacy will be assessed 12 weeks after initial PH-10 treatment. Subjects will be followed for a total of 16 weeks to allow assessment of Durability of Response of treated lesions and comprehensive follow-up of adverse events.",,PHASE2,Dermatology,Dermatology disorder,Condition
NCT02075021,Phase I/II Trial of the Combination of Lenalidomide (Revlimid) and Nab-paclitaxel (Abraxane) in the Treatment of Relapsed/Refractory Multiple Myeloma,PI left the institution,Other/Unclear,"The investigators will perform a phase I/II trial of Revlimid daily for 21 days and Abraxane weekly for 3 weeks. Accrual will be on standard cohorts of 3 patients. Once the maximum toxicity dose (MTD) is reached, the level below will be expanded to 25 patients for a pilot phase II trial. All treatments will be performed until progression. Assessments will be made at least at the 2, 4 and 6 month timepoints and monthly thereafter until progression.~The purpose of this research study is to determine how much of the combination of Revlimid and Abraxane can be given safely and how well they work together against the cancer.~Currently, this trial is in the phase 1 stage.","Revlimid is an important imid based therapy of myeloma. However patients will still relapse after this drug and then have limited options. Abraxane has shown efficacy in a number of cancers, putatively through intratumor concentration by SPARC (secreted protein acidic and rich in cysteine). (Taxanes have shown a modest activity in myeloma. Interestingly, Revlimid can upregulate the levels of SPARC. Thus, investigators will test the toxicity and efficacy of a combination of Revlimid and Abraxane in relapsed/refractory myeloma.~Investigators will perform a phase I/II trial of Revlimid daily for 21 days and Abraxane weekly for 3 weeks in patients who have failed Revlimid but have adequate blood counts and renal function and minimal neuropathy. For study purposes, 1 cycle is considered to be 4 weeks (20 days). Subjects will get Abraxane for three weeks and will be off of this treatment for 1 week. There are 10 visits per cycle. Accrual will be on standard 3 patient cohorts. Once the maximum tolerated dose is reached, the level below will be expanded to 25 patients for a pilot phase II trial. All treatments will be performed until progression. Assessments will be made at least at the 2, 4, and 6 month timepoints and monthly thereafter until progression.~Since both drugs can cause myelosuppression, investigators will start with doses below their standard doses as single agents. Investigators will use 100 mg/m2 of Abraxane weekly for 3 weeks and 10 mg Revlimid daily for 21 days, with a dose escalation for Revlimid to 15 mg and to 25 mg. Dose de-escalations will also be performed for both drugs as necessary. Investigators will explore whether SPARC (secreted protein acidic and rich in cysteine) expression is altered by flow cytometry and immunohistochemistry.",PHASE1/PHASE2,Oncology,Other cancer,MeSH
NCT00793650,Combination High Dose Melphalan and Autologous Peripheral Blood Stem Cell (PBSC) Transplant With Bortezomib for Multiple Myeloma: A Dose and Schedule Finding Study,,Unknown,"The goal of this study is to evaluate the safety of melphalan and autologous PBSCT (peripheral blood stem cell transplantation - stem cells that come from your own body) in combination with bortezomib, a new FDA approved drug used to treat myeloma.",,PHASE1/PHASE2,Oncology,Other cancer,MeSH
NCT03670901,A Study to Compare the Efficacy and Safety of JHL1101 Versus Rituximab in Patients With Previously Untreated Diffuse Large B-Cell Lymphoma (DLBCL),The development was stopped due to company's strategy consideration,Other/Unclear,"Approximately 500 subjects will be enrolled in this study. Subjects who meet the inclusion criteria will be randomized (1:1) into two groups. The study group will receive JHL1101 in combination with CHOP regimen, and the control group will receive rituximab (MabThera) in combination with CHOP. The dose of 375 mg/m2 is given intravenously on Day 1 (D1) of each cycle, and CHOP regimen is administered after the infusion of JHL1101 or rituximab is completed. Efficacy evaluation will be performed at baseline, after 3 cycles treatment (D18± 2 of Cycle 3, before the next cycle of treatment) and after 6 cycles treatment (D21±3 of Cycle 6). Subjects evaluated as progressive disease (PD) should be withdrawn from the study treatment and their subsequent treatments will be determined by the investigator. The analysis of primary endpoint is the ORR over the 6-cycle treatment period.",,PHASE3,Oncology,lymphoma,MeSH
NCT00766870,Efficacy and Safety of Lu AA34893 in Patients With Major Depressive Disorder,Study was previously paused and is now terminated,Other/Unclear,"The purpose of the study is to evaluate the efficacy, safety and tolerability of three fixed dosages of Lu AA34893 compared to placebo in the treatment of patients with Major Depressive Disorder.","Major Depressive Disorder (MDD) is reported to be the most common mood disorder, with a lifetime prevalence of about 15% and as high as 25% in women. MDD is characterised by the presence of one or more Major Depressive Episodes (MDEs) that presents with depressed mood, loss of interest or pleasure, disturbed sleep or appetite, low energy, feelings of guilt or low self-worth, and poor concentration. MDD is a disabling, severe illness that tends to be chronic, and repeated episodes are common. Despite the availability of a range of effective treatments in MDD, a significant proportion of patients do not respond or achieve remission and many relapse despite continued treatment. Lu AA34893 has a novel mechanism of action and this could be of clinical relevance in addressing currently unmet needs in MDD.",PHASE2,Psychiatry,Psychiatry disorder,MeSH
NCT00162253,Study of BMS-587101 in Patients With Moderate to Severe Psoriasis,,Unknown,The purpose of this clinical research study is to learn if BMS-587101 is effective on the treatment of Moderate to Severe Psoriasis. The safety of this treatment will also be studied.,,PHASE2,Dermatology,Dermatology disorder,MeSH
NCT04326283,"Trial of Safety, Tolerability and Efficacy of Trametinib (SNR1611) in Patients With Amyotrophic Lateral Sclerosis (ALS)",Terminated as it is considered that necessary data have been collected,Other/Unclear,"The purpose of this study is to evaluate the safety, tolerability and efficacy of trametinib (SNR1611) in the treatment of amyotrophic lateral sclerosis.","Trametinib (SNR1611) is a MEK inhibitor that downregulates the MAPK/ERK pathway. In this study, the potential of MAPK/ERK pathway downregulation through trametinib (SNR1611) as a therapeutic treatment for amyotrophic lateral sclerosis (ALS) will be evaluated.",PHASE1/PHASE2,Neurology,Neurological disorder,MeSH
NCT00827671,Study of Combination of Cetuximab and Radiotherapy Added to the Standard Treatment for Oesophageal Adenocarcinoma,Experimental treatment not feasible due to high rate of drop out,Other/Unclear,The purpose of this study is to determine whether the addition of the combination between cetuximab and radiotherapy to the standard chemotherapy for resectable oesophageal cancer is safe and adds efficacy.,"This study aims at developing a novel strategy to optimize the treatment of oesophageal adenocarcinoma and gastro-oesophageal junctional tumors with curative intent. Surgery in combination with peri-operative chemotherapy, using the combination epirubicin, cisplatin and 5-FU, as defined by the recent MAGIC trial, results in 13% increase in 5-yr survival. To improve the outcome of patients with this disease we hypothesize that the addition of pre-operative combined cetuximab-radiotherapy (cetux-RT) treatment could improve the outcome of this patient category through better local control.",PHASE2,Oncology,Other cancer,Condition
